"type","pantry_name","address","borough","zipcode","days","weeks_in_month","hours"
"FP","CHRISTIAN FELLOWSHIP SEVENTH DAY ADVENTIST COMMUNITY SVCS-F.P.","777 SCHENECTADY AVENUE","Brooklyn",11203,"WED","1,2,3,4","10:30AM-12:30PM"
"SK","CHRISTIAN FELLOWSHIP SEVENTH DAY ADVENTIST COMMUNITY SVCS-S.K.","777 SCHENECTADY AVENUE","Brooklyn",11203,"MON,TUE,WED",NA,"5-6PM"
"FP","ELITE LEARNERS, INC","4517 AVENUE D","Brooklyn",11203,"THUR",NA,"10AM-12PM"
"FP","GOD'S BATTALION OF PRAYER CHURCH","661 LINDEN BOULEVARD","Brooklyn",11203,"TUE,THUR",NA,"9AM-12PM"
"FP","MOUNT CARMEL WORSHIP AND OUTREACH CENTER","784 EAST 46TH STREET","Brooklyn",11203,"MON",NA,"12-2PM"
"FP","MUNA SOCIAL SERVICE EAST FLATBUSH","167 EAST 43RD STREET","Brooklyn",11203,"MON","2,4","5-6PM"
"FP","PENIEL SEVENTH DAY ADVENTIST CHURCH","1210 UTICA AVENUE","Brooklyn",11203,"FRI",NA,"10AM-12PM"
"FP","SHALOM SENIOR CENTER","483 ALBANY AVE","Brooklyn",11203,"MON,TUES,WED,THUR,FRI",NA,"12-1PM"
"FP","ST. THERESE OF LISIEUX R.C. CHURCH","4410 AVENUE D","Brooklyn",11203,"TUE",NA,"10:30AM-12:30PM"
"FP","THE CITY OF GRACE INC","3402 TILDEN AVENUE","Brooklyn",11203,"TUE",NA,"11AM-1PM"
"SK","UNITED COMMUNITY BAPTIST CHURCH","545 UTICA AVENUE","Brooklyn",11203,"SAT",NA,"10AM-12PM"
"FP","PAYO MOBILE FOOD PANTRY","2483 65TH STREET","Brooklyn",11204,"FRI",NA,"1:30-2:30PM"
"FP","REACHING-OUT COMMUNITY SERVICES INC","6417 18TH AVENUE","Brooklyn",11204,"MON,TUES,WED,THUR,FRI",NA,"9AM-5PM"
"FP","ST. ATHANASIUS R.C. CHURCH FP","2154 61ST STREET","Brooklyn",11204,"MON",NA,"3:15-5PM"
"FP","CELESTIAL CHURCH OF CHRIST ILERI PARISH","138 WAVERLY AVENUE","Brooklyn",11205,"SAT","2","12-3PM"
"FP","CITY HARVEST - BED-STUY MOBILE MARKET","736 PARK AVENUE","Brooklyn",11206,"WED,SAT","1","9:30-11:30AM"
"FP","COMPASSION HOUSE COMMUNITY DEVELOPMENT CORPORATION","43 GEORGE STREET","Brooklyn",11206,"THUR","1,3","9-11:30AM"
"FP","SANTANA & VARGAS CHARITIES, INC","576 WILLOUGHBY AVENUE","Brooklyn",11206,"MON,TUES,WED,SAT,SUN",NA,"10AM-12:3P/12-3P/3-5P"
"FP","SOLID ROCK BAPTIST CHURCH","120 TOMPKINS AVE","Brooklyn",11206,"MON,THUR",NA,"9AM-12PM"
"FP","ST. STEPHEN OUTREACH COMMUNITY DEVELOPMENT CORPORATION","874 MYRTLE AVENUE","Brooklyn",11206,"WED,FRI",NA,"9-10:30AM"
"SK","ST. STEPHEN OUTREACH COMMUNITY DEVELOPMENT CORPORATION","874 MYRTLE AVENUE","Brooklyn",11206,"WED,THUR,FRI",NA,"11AM-1PM"
"FP","TRINITY HUMAN SERVICE CORPORATION","153 A JOHNSON AVENUE","Brooklyn",11206,"TUES,WED,THUR,FRI",NA,"9AM-12PM&1-4PM"
"FP","BETHLEM NATION'S FOOD PANTRY","1962-84 LINDEN BLVD","Brooklyn",11207,"SAT","4 ONLY","10AM-12PM"
"FP","CHRISTIAN CULTURAL CENTER","12020 FLATLANDS AVENUE","Brooklyn",11207,"THUR",NA,"9AM-3PM"
"FP","CHURCH OF GOD PROPHECY","71 MALTA STREET","Brooklyn",11207,"TUE","2,4","3:30-6PM"
"SK","CHURCH OF GOD PROPHECY","71 MALTA STREET","Brooklyn",11207,"TUE","2,4","3:30-6PM"
"FP","CORNERSTONE SEVENTH DAY ADVENTIST CHURCH","138 PENNSYLVANIA AVE","Brooklyn",11207,"THUR",NA,"10AM-12PM"
"SK","CORNERSTONE SEVENTH DAY ADVENTIST CHURCH","138 PENNSYLVANIA AVE","Brooklyn",11207,"SUN",NA,"11:30AM-1:30PM"
"FP","EAST NEW YORK WESLEYAN CHURCH/NEW HOPE FAMILY WORSHIP CENT","817 LIVONIA AVENUE","Brooklyn",11207,"SAT",NA,"11AM - 1PM"
"FP","FAMILY SERVICE NETWORK OF N.Y. INC","1420 BUSHWICK AVENUE","Brooklyn",11207,"MON,WED",NA,"9AM-1PM"
"FP","HOPE EMPOWERMENT AND DEVELOPMENT ZONE FOOD PANTRY","369 NEW LOTS AVENUE","Brooklyn",11207,"SAT","3","12-4PM"
"FP","HOUSE OF DAVID WORSHIP CENTER","747-749-HENDRIX STREET","Brooklyn",11207,"WED",NA,"10:30AM-12:30PM"
"FP","ICL AND CHN FOOD PANTRY","2581 ATLANTIC AVENUE","Brooklyn",11207,"WED",NA,"10AM-1PM"
"FP","MUNA SOCIAL SERVICE AN-NAMIRAH","2135 PITKIN AVENUE","Brooklyn",11207,"MON","1,3","2-3PM"
"FP","MYLAH'S ORGANIZATION INC","509 VAN SICLEN AVENUE","Brooklyn",11207,"TUE","2,4","9-11AM"
"FP","BLESSED SACRAMENT CHURCH (BKLYN)","198 EUCLID AVENUE","Brooklyn",11208,"WED",NA,"9:30-11:30AM"
"FP","CITY OF REFUGE FP","1115 BLAKE AVENUE","Brooklyn",11208,"WED",NA,"9:30AM-12PM"
"FP","EAST NEW YORK SEVENTH DAY ADVENTIST CHURCH","511 ELTON STREET","Brooklyn",11208,"THUR","2,4","11AM-2PM"
"FP","ISAIAH'S TEMPLE OF MT. HOPE","862 GLENMORE AVE","Brooklyn",11208,"THUR",NA,"2-4PM"
"SK","ISAIAH'S TEMPLE OF MT. HOPE","862 GLENMORE AVE","Brooklyn",11208,"TUE,THUR",NA,"2-4PM"
"FP","LAS MARAVILLAS DEL EXODO","302 ELTON STREET","Brooklyn",11208,"WED",NA,"9-11AM"
"FP","MUNA SOCIAL SERVICE INC","1033 GLENMORE AVENUE","Brooklyn",11208,"WED",NA,"3-5PM"
"FP","OPEN DOOR TO HEAVEN OUTREACH MINISTRY INC","474 SHEPHERD AVENUE","Brooklyn",11208,"SAT","3","1-2PM"
"FP","PRESBYTERIAN CHURCH OF THE CROSSROADS","133 ELTON STREET","Brooklyn",11208,"WED","2,4","10AM-12PM"
"FP","SECOND ST. PAUL CHURCH OF CHRIST, DISCIPLE OF CHRIST, INC","1048 SUTTER AVE","Brooklyn",11208,"SAT","2,4","8-10AM"
"FP","YMCA COMMUNITY MARKET-NORTH BROOKLYN YMCA","570 JAMAICA AVENUE","Brooklyn",11208,"TUE","1,3","12-5PM"
"FP","BRCDC FOOD PROGRAM","9818 FORT HAMILITON PARKWAY","Brooklyn",11209,"SAT",NA,"11AM-2PM"
"FP","OUR LADY OF ANGELS HUMAN SERVICES","336 73RD STREET","Brooklyn",11209,"WED",NA,"9:30AM-12PM&1:30-3PM"
"FP","ADMIRABLE CHURCH INC","1910 FLATBUSH AVENUE","Brooklyn",11210,"SAT","4","10AM-12PM"
"FP","COMMUNITY CARE FOOD PANTRY","1387 EAST 37TH STREET","Brooklyn",11210,"SAT",NA,"11AM-2:30PM"
"FP","EVANGELICAL CRUSADE FOOD PANTRY","557 EAST 31ST STREET","Brooklyn",11210,"WED","2,4","2-4PM"
"FP","LIFEBRIDGE NY","1895 FLATBUSH AVENUE","Brooklyn",11210,"WED",NA,"5-7PM"
"FP","OUR LADY OF REFUGE R.C. CHURCH","2020 FOSTER AVE.","Brooklyn",11210,"WED",NA,"10AM - 1PM"
"FP","TREASURES IN EARTHEN JARS FOOD PANTRY","4124 AVENUE H","Brooklyn",11210,"SAT",NA,"1-3PM"
"FP","SOUTHSIDE UNITED H.D.F.C., INC - LOS SURES","145 SOUTH 3RD STREET","Brooklyn",11211,"TUE",NA,"9AM-12PM"
"FP","TRANSFIGURATION CHURCH","263 & 280 MARCY AVENUE","Brooklyn",11211,"TUE, WED",NA,"9AM-12PM"
"FP","BETHANY GOSPEL CHAPEL INC","521 THOMAS S. BOYLAND STREET","Brooklyn",11212,"SAT","2,4","6:30-7:30AM"
"FP","BROWNSVILLE TEMPLE SEVENTH DAY ADVENTIST CHURCH","1089 CLARKSON AVE","Brooklyn",11212,"SUN","1,3","11AM-1PM"
"FP","CHURCH OF GOD INC.","1011 WINTHROP STREET","Brooklyn",11212,"SAT",NA,"12-1PM"
"FP","EBENEZER SEVENTH DAY ADVENTIST CHURCH","1234 EAST NEW YORK AVENUE","Brooklyn",11212,"WED",NA,"10:30AM-12PM"
"FP","HOPE CENTER DEVELOPMENT CORPORATION","414 EAST 95TH STREET","Brooklyn",11212,"SAT","1,2,3,4","11AM-1:30PM"
"SK","HOPE CENTER DEVELOPMENT CORPORATION","409 EAST 95TH STREET","Brooklyn",11212,"SAT","1,2,3,4","11AM-1:30PM"
"FP","LITTLE JERUSALEM HOUSE OF PRAYER","447 HERZL STREET","Brooklyn",11212,"SAT","2,4","1-2PM"
"FP","MT. HEBRON CHURCH OF CHRIST","167 CHESTER STREET","Brooklyn",11212,"SAT",NA,"9-10:30AM"
"FP","NEW LIFE SEVENTH DAY ADVENTIST CHURCH","885-87 THOMAS BOYLAND STREET","Brooklyn",11212,"MON,TUE,SUN",NA,"5-7PM/6-8PM/8-10AM"
"FP","OUR LADY OF MERCY CHURCH","680 MOTHER GASTON BLVD.","Brooklyn",11212,"MON,FRI",NA,"9-11AM"
"FP","PEOPLES BAPTIST CHURCH","105 RIVERDALE AVENUE","Brooklyn",11212,"SAT","2,4","12-2PM"
"FP","URBAN STRATEGIES INC","61-71 RIVERDALE AVENUE","Brooklyn",11212,"TUE",NA,"8-10AM"
"FP","WORLD FOR CHRIST FOOD SERVICES","1091 CLARKSON AVENUE","Brooklyn",11212,"SAT(2,4)",NA,"10AM-12PM"
"SK","BETHANY UNITED METHODIST CHURCH","1208 ST. JOHN'S PLACE","Brooklyn",11213,"TUE, THUR","1","12:30-2:30PM/ 5-7PM"
"FP","BETTER COMMUNITY FOOD PANTRY","218 BUFFALO AVENUE","Brooklyn",11213,"SAT",NA,"9AM-1PM"
"FP","CROWN HEIGHTS JEWISH COMMUNITY COUNCIL","899 MONTGOMERY STREET","Brooklyn",11213,"WED",NA,"1:30-3PM"
"FP","NAT'L COMM. FOR FUTH. OF JEWISH ED.(UC)","824 EASTERN PARKWAY","Brooklyn",11213,"FRI",NA,"12-1PM"
"FP","THE CHURCH OF ST. MARK","1417 UNION STREET","Brooklyn",11213,"FRI","1,2,3,4","11:30AM-1:30PM"
"FP","BENSONHURST COUNCIL OF JEWISH ORGANIZATIONS","8635 21ST AVE","Brooklyn",11214,"TUE",NA,"10AM-4PM"
"FP","HEALTH ESSENTIAL ASSOCIATION CPMM","2336 86TH STREET","Brooklyn",11214,"THUR","1,3","10AM-12PM"
"FP","WE CREATE COMMUNITY FOOD PANTRY","8501 NEW UTRECHT AVENUE","Brooklyn",11214,"THUR",NA,"10:30-11:30AM"
"FP","AL-MADINAH SCHOOL INC","383 3RD AVENUE","Brooklyn",11215,"FRI","3","12:30-2:30PM"
"FP","CAMP FRIENDSHIP FOOD PANTRY IN PARK SLOPE","339 8TH STREET","Brooklyn",11215,"SAT",NA,"9AM-12PM"
"FP","BEDFORD CENTRAL PRESBYTERIAN CHURCH","1200 DEAN STREET","Brooklyn",11216,"THUR","2,4","10:30AM-2:30PM"
"FP","BEULAH CHURCH OF GOD IN CHRIST JESUS","956 MARCY AVENUE","Brooklyn",11216,"TUE,THUR",NA,"10:30AM-1PM"
"FP","FAMILY LIFE DEVELOPMENT CENTER","1476 BEDFORD AVENUE","Brooklyn",11216,"MON",NA,"4-6PM"
"FP","HEBRON SEVENTH DAY ADVENTIST CHURCH","1256 DEAN STREET","Brooklyn",11216,"WED","1,3","9-10:30AM"
"SK","HEBRON SEVENTH DAY ADVENTIST CHURCH","1256 DEAN STREET","Brooklyn",11216,"SUN",NA,"12:30-2PM"
"FP","MUNA SOCIAL SERVICE DOWNTOWN BROOKLYN","50 NEW YORK AVENUE","Brooklyn",11216,"MON","1,3","4-5PM"
"SK","NEWMAN MEMORIAL UNITED CHURCH COMMUNITY DEVELOPMENT CORP.","257 MACON STREET","Brooklyn",11216,"SAT",NA,"10AM-2PM"
"FP","NEWMAN MEMORIAL UNITED METHODIST CHURCH COMMUNITY DEVELOPM","257 MACON STREET","Brooklyn",11216,"SAT",NA,"10AM-2PM"
"FP","SILOAM PRESBYTERIAN CHURCH FOOD PANTRY","260 JEFFERSON AVENUE","Brooklyn",11216,"WED",NA,"10AM-12PM"
"SK","ST. GEORGE'S EPISCOPAL CHURCH","800 MARCY AVENUE","Brooklyn",11216,"TUES,WED,THUR",NA,"12:30-2PM"
"FP","ST. GEORGE'S EPISCOPAL CHURCH FOOD PANTRY","800 MARCY AVENUE","Brooklyn",11216,"FRI",NA,"10AM-3PM"
"FP","THE SALVATION ARMY BEDFORD TEMPLE CORPS","601 LAFAYETTE AVENUE","Brooklyn",11216,"WED",NA,"10AM-12PM"
"FP","THE TEMPLE OF RESTORATION TTOR FOOD PANTRY","18 HERKIMER PLACE","Brooklyn",11216,"THUR,THUR,SAT",NA,"10AM-4PM/10AM-1PM"
"FP","COMMUNITY HELP IN PARK SLOPE","200 FOURTH AVENUE","Brooklyn",11217,"THUR,SAT",NA,"11:30AM-1PM"
"SK","COMMUNITY HELP IN PARK SLOPE INC","200 FOURTH AVENUE","Brooklyn",11217,"MON,TUES,WED,THUR,FRI,SAT",NA,"9-10:30AM & 11:30AM-1PM"
"FP","HANSON PLACE SEVENTH DAY ADVENTIST CHURCH","88 HANSON PLACE","Brooklyn",11217,"THUR",NA,"1:30-5PM"
"FP","IMMANUEL FIRST SPANISH UNITED METHODIST CHURCH","424 DEAN STREET","Brooklyn",11217,"TUE",NA,"1-2:45PM"
"FP","NEXT STEP COMMUNITY CHURCH","360 SCHERMERHORN STREET","Brooklyn",11217,"SAT","2,3,4","9-10:30AM"
"SK","NEXT STEP COMMUNITY CHURCH","360 SCHERMERHORN STREET","Brooklyn",11217,"MON,TUE,WED",NA,"9-10AM"
"FP","SOUTH BKLYN SEVENTH DAY ADVENTIST CHURCH COMMUNITY SERVICE P","42 PROSPECT PLACE","Brooklyn",11217,"SUN","1,3","11AM-2PM"
"FP","CHRIST APOSTOLIC CHURCH GOKE FOOD PANTRY","622 CORTELYOU ROAD","Brooklyn",11218,"TUE,SAT","2,4","2-4PM/9AM-1PM"
"FP","MUNA SOCIAL SERVICE BROOKLYN ISLAMIC CENTER","722 CHURCH AVENUE","Brooklyn",11218,"MON","2,4","3-4PM"
"FP","PASWO (PAKISTANI AMERICAN SKILLED WOMEN ORGANIZATION, INC)","930 DITMAS AVENUE","Brooklyn",11218,"WED",NA,"1-3PM"
"FP","TOMCHE SHABBOS OF BORO PARK","6225 NEW UTRECHT AVE","Brooklyn",11219,"WED",NA,"3-5PM"
"FP","ZICHRON ACHEINU LEVY-MENACHEM TZION","4518 11TH AVENUE","Brooklyn",11219,"WED",NA,"10-11AM"
"FP","ACADEMY OF MEDICAL & PUBLIC HEALTH SERVICES (AMPHS)","5306 3RD AVENUE - 2ND FL","Brooklyn",11220,"SAT","1,3","2-4PM"
"FP","MUSLIMS GIVE BACK","273 54TH STREET","Brooklyn",11220,"SAT",NA,"10AM-12PM"
"FP","THE SALVATION ARMY SUNSET PARK CORPS","520 50TH STREET","Brooklyn",11220,"TUE,WED,THUR",NA,"10AM-12PM"
"SK","THE SALVATION ARMY SUNSET PARK CORPS","520 50TH STREET","Brooklyn",11220,"TUES,WED,THUR",NA,"12:30-1:30PM"
"FP","THE TABLE AT THE FAMILY SUPPORT CENTER AT NYU LANGONE","550 59TH STREET","Brooklyn",11220,"FRI",NA,"9AM-12PM"
"FP","COLLECTIVE FOCUS FOOD JUSTICE PANTRY PROGRAM","1046 BROADWAY","Brooklyn",11221,"TUE",NA,"1-3PM"
"FP","FAITH CENTER FOR HUMAN SERVICES, INC","1014-18 GATES AVENUE","Brooklyn",11221,"SAT",NA,"9:30AM-12PM"
"SK","FAITH CENTER FOR HUMAN SERVICES, INC","1014-18 GATES AVENUE","Brooklyn",11221,"SAT",NA,"9:30AM-12PM"
"FP","METRO MINISTRIES INTERNATIONAL","871 BUSHWICH AVENUE","Brooklyn",11221,"SAT","1,3","10:30AM-12PM"
"FP","NORTHEAST BROOKLYN HOUSING DEVELOPMENT CORPORATION","376 THROOP AVENUE","Brooklyn",11221,"TUE,THUR,SAT","3","9AM-12PM/10AM-12PM"
"FP","OPEN DOOR FAMILY LIFE CENTER INC","999 GREEN AVENUE","Brooklyn",11221,"SAT",NA,"8:30-10:30AM"
"FP","ST. JOHN'S BREAD & LIFE FOOD PANTRY","795 LEXINGTON AVE","Brooklyn",11221,"MON,TUES,WED,THUR",NA,"8AM-1PM"
"SK","ST. JOHN'S BREAD & LIFE PROGRAM","795 LEXINGTON AVE","Brooklyn",11221,"MON,TUES,WED,THUR",NA,"10AM-12PM"
"FP","THE SALVATION ARMY BUSHWICK CORPS","1151 BUSHWICK AVENUE","Brooklyn",11221,"MON,TUE,THUR",NA,"10AM-12:30PM"
"SK","THE SALVATION ARMY BUSHWICK CORPS","1151 BUSHWICK AVENUE","Brooklyn",11221,"MON,TUE,THUR,FRI",NA,"12:30-2PM"
"FP","THURSTON MEMORIAL OUTREACH MINISTRIES","1243 BUSHWICK AVE","Brooklyn",11221,"FRI",NA,"2-4:30PM"
"FP","GREENPOINT REFORMED CHURCH FOOD PANTRY","136 MILTON STREET","Brooklyn",11222,"THUR",NA,"4-7PM"
"FP","OUR LADY OF GRACE PARISH MINISTRY","2322 EAST 4TH STREET","Brooklyn",11223,"MON,WED,THUR",NA,"9-11:30AM"
"SK","OUR LADY OF GRACE PARISH MINISTRY","3162 BRIGHTON 4TH STREET","Brooklyn",11223,"WED",NA,"12-12:30PM"
"FP","SALT & SEA MISSION CHURCH INC.","2417-2419 STILLWELL AVE","Brooklyn",11223,"TUE,THUR,SUN",NA,"10:30AM-12:45PM"
"FP","SEPHARDIC BIKUR HOLIM FOOD PANTRY","425 KINGS HIGHWAY","Brooklyn",11223,"MON,TUE,WED,THUR,FRI,TUE,THUR",NA,"9A-12:30P/9-11A/2-3:30P"
"FP","ACTS COMMUNITY DEVELOPMENT CORPORATION","2114 MERMAID AVE","Brooklyn",11224,"TUE,THUR",NA,"6-7:15M/11AM-2:15PM"
"SK","ACTS COMMUNITY DEVELOPMENT CORPORATION","2114 MERMAID AVE","Brooklyn",11224,"WED,FRI",NA,"6-7:15PM"
"FP","CATHOLIC CHARITIES","2866 WEST 17TH STREET","Brooklyn",11224,"MON",NA,"9:30AM-1:30PM"
"FP","KINGDOM GLOBAL MISSIONS","2945 WEST 33RD STREET","Brooklyn",11224,"SAT","1,3","12-3PM"
"FP","CHANCE FOR CHILDREN","11 McKEEVER PLACE - 1ST FLOOR (BASEMENT LEVEL)","Brooklyn",11225,"FRI",NA,"10AM-12:30PM"
"FP","GETHSEMANE SEVENTH DAY ADVENTIST CHURCH","357 EMPIRE BLVD","Brooklyn",11225,"SUN,WED",NA,"12-1PM/5-6PM"
"FP","HOREB SEVENTH DAY ADVENTIST COMMUNITY SERVICES","520 KINGSTON AVE","Brooklyn",11225,"TUE",NA,"10-11AM"
"FP","LADIES IN WAITING","276 FENIMORE STREET","Brooklyn",11225,"TUE",NA,"10AM-1PM"
"FP","SANCTIFIED CHURCH OF GOD, INC/COMMUNITY FEEDING PROGRAM","404 LEFFERTS AVE","Brooklyn",11225,"SAT",NA,"12-1PM"
"FP","BETHANIE FRENCH SEVENTH DAY ADVENTIST CHURCH","2059 BEDFORD AVENUE","Brooklyn",11226,"THUR","1,3","10AM-12PM"
"FP","CALVARY PENTECOSTAL CHURCH","151 WOODRUFF AVENUE","Brooklyn",11226,"THUR",NA,"10AM-12PM"
"FP","CHURCH OF GOD OF SALVATION","1615 NOSTRAND AVE","Brooklyn",11226,"WED,THUR",NA,"2-4PM/10AM-4PM"
"FP","EMMAUS SEVENTH DAY ADVENTIST CHURCH","1144 FLATBUSH AVENUE","Brooklyn",11226,"TUE",NA,"12:30-2PM"
"FP","FERNANDE VALME' MINISTRIES INC","1120 FLATBUSH AVE","Brooklyn",11226,"THUR",NA,"10-11AM"
"FP","FLATBUSH SEVENTH DAY ADVENTIST CHURCH","261 EAST 21ST STREET","Brooklyn",11226,"MON",NA,"11AM-1PM"
"FP","GOSHEN TEMPLE OF SEVENTH DAY ADVENTIST CHURCH","2414 CHURCH AVENUE","Brooklyn",11226,"WED",NA,"1-3PM"
"FP","HOLY CROSS FOOD PANTRY - BROOKLYN","2530 CHURCH AVENUE","Brooklyn",11226,"TUE,THUR",NA,"2-3:30PM"
"FP","PENIEL HAITIAN CHURCH OF C AND MA","2741 ALBEMARLE ROAD","Brooklyn",11226,"SAT,SAT","2","10AM-12PM/1-3PM"
"FP","ST. MARK'S UNITED METHODIST CHURCH","2017 BEVERLEY ROAD","Brooklyn",11226,"FRI",NA,"12-3PM"
"FP","HEALTH ESSENTIAL ASSOCIATION INC","2101 EAST 16TH STREET - 2ND FLOOR","Brooklyn",11229,"FRI","4","10AM-12PM"
"FP","KINGS BAY Y FOOD PANTRY","3495 NOSTRAND AVENUE","Brooklyn",11229,"FRI","2","9:30-11AM"
"FP","BROOKLYN MEAL SHARE","1323 FOSTER AVENUE","Brooklyn",11230,"SAT",NA,"5-7PM"
"FP","COPO FOOD PANTRY","1077 CONEY ISLAND AVENUE","Brooklyn",11230,"FRI",NA,"10:30AM-4:30PM"
"FP","ICNA RELIEF QUBA PANTRY","634 RUGBY ROAD","Brooklyn",11230,"TUE",NA,"1-3PM"
"FP","MASBIA OF FLATBUSH","1372 CONEY ISLAND AVE","Brooklyn",11230,"MON,TUES,WED,THUR",NA,"11AM-7PM"
"SK","MASBIA OF FLATBUSH","1372 CONEY ISLAND AVE","Brooklyn",11230,"MON,TUES,WED,THUR",NA,"3-7PM"
"FP","PAYO FOOD PANTRY","1045 CONEY ISLAND AVENUE","Brooklyn",11230,"THUR",NA,"3-5PM"
"FP","FOOD FIRST, INC","165 CONOVER STREET","Brooklyn",11231,"WED,FRI",NA,"11AM-1PM/10AM-12PM"
"FP","MOVEMENT OF PENTECOSTAL CHRISTIAN CHURCH","90-92 SUMMIT STREET","Brooklyn",11231,"SUN",NA,"12:30-2PM"
"FP","RED HOOK COMMUNITY - REDEMPTION CHURCH","27 HUNTINGTON STREET","Brooklyn",11231,"THUR",NA,"10AM-12PM"
"FP","CENTER FOR FAMILY LIFE","443 39TH STREET","Brooklyn",11232,"TUE, WED, THUR",NA,"1-4PM"
"FP","BLESSED ASSURANCE CHURCH OF GOD BLESSED ASSURANCE CHARITY IN","2093 FULTON STREET","Brooklyn",11233,"SAT",NA,"9-11AM"
"FP","BROOKLYN RESCUE MISSION URBAN HARVEST CENTER INC","426 DECATUR STREET","Brooklyn",11233,"TUE,WED",NA,"10-11:30AM"
"FP","CHURCH OF PRAISE AND WORSHIP GOD IN CHRIST","526 RALPH AVENUE","Brooklyn",11233,"SAT",NA,"10AM-1PM"
"FP","COMMUNITY SERVICES HOUSING DEVELOPMENT CORP.","547 HOWARD AVE","Brooklyn",11233,"THUR",NA,"10AM-12PM"
"FP","GLOVER MEMORIAL BREAD OF LIFE FOOD PANTRY","2134 DEAN STREET","Brooklyn",11233,"WED",NA,"12-2PM"
"FP","GOD'S DELIVERANCE TEMPLE, INC","438 RALPH AVENUE","Brooklyn",11233,"TUE",NA,"11AM-12PM"
"SK","NEIGHBORS TOGETHER","2094 FULTON STREET","Brooklyn",11233,"MON,TUES,WED,THUR,FRI,MON,TUES,WED,THUR",NA,"12-2PM/4-6PM"
"SK","OPIN (OTHER PEOPLE IN NEED)","1768 ST. JOHNS PLACE","Brooklyn",11233,"FRI",NA,"2-4PM"
"FP","ST. PAUL PENTECOSTAL CHURCH","133 THOMAS S BOYLAND STREET","Brooklyn",11233,"SAT",NA,"11AM - 1PM"
"FP","ST. PHILIP'S EPISCOPAL/ST. BENEDICT'S PANTRY","265 DECATUR STREET","Brooklyn",11233,"WED",NA,"11AM-1PM"
"FP","TRUE HOLY CHURCH OF GOD IN CHRIST JESUS","2364 ATLANTIC AVENUE","Brooklyn",11233,"SAT",NA,"10AM-12PM"
"FP","BNAI RAPHAEL CHESED ORGANIZATION INC","3846 FLATLANDS AVENUE","Brooklyn",11234,"MON,TUE,WED,THU,FRI,SUN",NA,"10A-3:3P/10A-5P/APPT ONLY"
"FP","FLATBUSH COMMUNITY FUND","1968 FLATBUSH AVENUE","Brooklyn",11234,"THUR",NA,"12-2PM"
"FP","GRANT HOUSE UNITY CORPORATION","2046 FLATBUSH AVENUE","Brooklyn",11234,"WED,THU",NA,"11AM-4PM"
"FP","MAMRE ENRICHMENT PROGRAM","1623 UTICA AVENUE","Brooklyn",11234,"SUN","1","10AM-12PM"
"FP","METROPOLITAN COUNCIL ON JEWISH POVERTY","5361 PRESTON COURT","Brooklyn",11234,"TUE,THUR",NA,"3-5PM"
"FP","APNA FOOD PANTRY BRIGHTON BEACH","225 NEPTUNE AVENUE","Brooklyn",11235,"WED",NA,"2-3PM"
"FP","CHABAD - OCEANVIEW JEWISH CENTER","3100 BRIGHTON 4TH STREET","Brooklyn",11235,"MON","1","10-11AM"
"FP","ICNA RELIEF USA FOOD PANTRY","273 NEPTUNE AVENUE","Brooklyn",11235,"MON",NA,"12-1PM"
"FP","BAY VIEW HOUSES RESIDENT ASSOCIATION","2085 ROCKAWAY PARKWAY","Brooklyn",11236,"THUR","1,2,3","9:30AM-1:30PM"
"FP","CHILDREN OF THE LIGHT INTERNATIONAL MINISTRIES INC","1171 EAST 95TH STREET","Brooklyn",11236,"MON,WED,FRI,SAT",NA,"10AM-3PM"
"FP","CHURCH OF GOD (BK)","627-29 REMSEN AVE","Brooklyn",11236,"SAT",NA,"12-2:30PM"
"FP","HEBREW EDUCATIONAL SOCIETY","9502 SEAVIEW AVENUE","Brooklyn",11236,"MON,WED,THUR,TUE,SUN",NA,"9A-2P/1-6PM/12-2PM"
"FP","INTERNATIONAL PENTECOSTAL CITY MISSION","9202-14 CHURCH AVE","Brooklyn",11236,"SAT",NA,"11AM-1PM"
"FP","OUR LADY OF MIRACLES-CANARSIE CLUSTER CENTER","757 EAST 86TH STREET","Brooklyn",11236,"SAT",NA,"10-11:30AM"
"FP","REDEEMED CHRISTIAN CHURCH OF GOD INTERNATIONAL CHAPEL","781 EAST 93RD STREET","Brooklyn",11236,"SAT",NA,"12-2PM"
"FP","CCC NEW YORK PARISH FOOD PANTRY OUTREACH PROGRAM","1380 JEFFERSON AVENUE","Brooklyn",11237,"SAT",NA,"10AM-2PM"
"FP","MAKE THE ROAD NEW YORK","301 GROVE STREET","Brooklyn",11237,"FRI",NA,"8-11AM"
"SK","BETHEL SEVENTH DAY ADVENTIST CHURCH","457 GRAND AVENUE","Brooklyn",11238,"SUN",NA,"1-2PM"
"FP","CHILD DEVELOPMENT SUPPORT CORPORATION","352-358 CLASSON AVE","Brooklyn",11238,"THUR",NA,"11AM-3PM"
"FP","CHURCH OF GOD FEEDING THE HUNGRY","836 CLASSON AVE","Brooklyn",11238,"THUR",NA,"10AM-12PM"
"FP","ST. TERESA OF AVILA","560 STERLING PLACE","Brooklyn",11238,"THUR","1,2,3,4","8-11AM"
"FP","JEWISH COMMUNITY COUNCIL OF CANARSIE   #1","1170 PENNSYLVANIA AVE","Brooklyn",11239,"WED",NA,"9:30-11:30AM"
"FP","SISTERS WITH PURPOSE INC","1540 VAN SICLEN AVE","Brooklyn",11239,"SAT",NA,"9-10AM"
"FP","FOOD SHARING WITH OUR NEIGHBORS PROGRAMS","3824 149TH STREET (FLUSHING)","Queen",11354,"THUR",NA,"10AM-12PM"
"FP","ICNA FLUSHING FOOD PANTRY","140-32 CHERRY AVENUE","Queen",11355,"WED",NA,"12-2PM"
"FP","SOUTH ASIAN COUNCIL FOR SOCIAL SERVICES","143-02 45TH AVENUE","Queen",11355,"WED,THUR",NA,"9:30AM-1PM"
"FP","NEW  BEGINNINGS FOOD PANTRY","242-01 BRADDOCK AVENUE (BELLROSE)","Queen",11357,"TUE","2","10-11:30AM"
"FP","SAM FIELD Y","58-25 LITTLE NECK PKWY (LITTLE NECK)","Queen",11362,"MON,WED,THUR,TUE,FRI",NA,"9A-2P/11A-2P/9A-12P"
"FP","CHAZAQ","141-47 72ND AVENUE (FLUSHING)","Queen",11367,"TUE",NA,"2:30-5PM"
"FP","KEHILAT SEPHARDIM OF AHAVAT ACHIM","150-62 78TH ROAD (FLUSHING)","Queen",11367,"MON,WED,TUE,THUR",NA,"11AM-1PM/10AM-1PM"
"FP","CORONA SEVENTH DAY ADVENTIST CHURCH","35-30 103RD STREET","Queen",11368,"SUN",NA,"12-2PM"
"SK","CORONA SEVENTH DAY ADVENTIST CHURCH","35-30 103RD STREET","Queen",11368,"MON",NA,"9-11AM"
"FP","IGLESIA CRISTIANA EVANGELICA","3435 96TH STREET (CORONA)","Queen",11368,"SAT",NA,"11AM-12PM"
"FP","MT. OLIVET GOSPEL CHURCH","33-27 97TH STREET, CORONA","Queen",11368,"WED",NA,"5:30-6:30PM"
"FP","NORTHEAST CONFERENCE COMMUNITY CENTER SDA","99-13 NORTHERN BLVD","Queen",11368,"TUE,,WED",NA,"11AM-1PM/3-6PM"
"FP","BRIGADA DE ESPERANZA INC","89-07 ASTORIA BLVD","Queen",11369,"SAT",NA,"12-3PM"
"SK","FIRST BAPTIST CHURCH","100-10 ASTORIA BLVD (EAST ELMHURST)","Queen",11369,"WED",NA,"12-1:45PM"
"FP","FIRST BAPTIST CHURCH OF CORONA","100-10 ASTORIA BLVD (EAST ELMHURST)","Queen",11369,"SAT",NA,"12-3PM"
"FP","LOVE WINS FOOD PANTRY - MERCADITO SOLIDARIO","3763 83RD STREET - SUITE #1B (JACKSON HEIGHTS)","Queen",11372,"FRI","4","1-5PM"
"FP","MAKE THE ROAD NEW YORK","92-10 ROOSEVELT AVENUE","Queen",11372,"WED",NA,"8-10AM"
"FP","MUNA SOCIAL SERVICES - JACKSON HEIGHTS COMMUNITY FOOD BANK","35-35 71ST STREET (JACKSON HEIGHTS)","Queen",11372,"THUR","1,3","2-3PM"
"FP","ST. MARK AME CHURCH/THE VOICE OF HAGAR","95-18 NORTHERN BLVD","Queen",11372,"TUE","1,2,3,4","12-2:45PM"
"FP","THE SALVATION ARMY QUEENS TEMPLE CORP","86-07 35TH AVENUE","Queen",11372,"MON,TUES,WED,THUR,FRI",NA,"11:30AM-1PM"
"SK","THE SALVATION ARMY QUEENS TEMPLE CORP","86-07 35TH AVENUE","Queen",11372,"THUR",NA,"10-11AM"
"FP","BETHANY PANTRY","48-08 91ST PLACE (ELMHURST)","Queen",11373,"SAT",NA,"9-10AM"
"FP","EVANGELICAL CHURCH CHRIST IS THE LIGHT","89-16 48TH AVENUE (ELMHURST)","Queen",11373,"FRI",NA,"9-11AM"
"FP","MINISTERIO LA LUZ DE LA ESPERANZA PARA LAS NACIONES DE JESUCRIST","79-01 BROADWAY  (ELMHURST)","Queen",11373,"THUR",NA,"5-7PM"
"FP","ESTHER GRUNBLATT-CENTRAL QUEENS Y","67-09 108TH STREET","Queen",11375,"MON,WED,TUE,THUR,SUN",NA,"9A-2P&3:30-6:30P/9A-2P/10A-1:"
"FP","FOREST HILLS SENIORS CENTER","108-25 62ND DRIVE","Queen",11375,"THUR",NA,"8:30-10:30AM"
"FP","MASBIA OF QUEENS","105-47 64TH ROAD","Queen",11375,"MON,TUES,WED,THUR,FRI,SUN",NA,"11A-7P/10A-2P/3-7P"
"SK","MASBIA OF QUEENS","105-47 64TH ROAD","Queen",11375,"SUN - THUR",NA,"3-7PM"
"FP","QUEENS JEWISH COMMUNITY COUNCIL","119-45 UNION TURNPIKE (FOREST HILLS)","Queen",11375,"MON,TUES,WED,THUR",NA,"11AM-2PM"
"FP","AIDS CENTER OF QUEENS COUNTY","62-07 WOODSIDE AVENUE - LOBBY","Queen",11377,"TUE",NA,"10AM-12PM"
"FP","BVM/ST. MARY'S CHURCH WINFIELD","70-31 48TH AVE (WOODSIDE)","Queen",11377,"THUR",NA,"9:30AM-12PM"
"FP","CORPUS CHRISTI FOOD PANTRY","31-30 61ST STREET","Queen",11377,"WED",NA,"9-10:30AM"
"FP","SAINT TERESA CHURCH - SAINT VINCENT DePAUL SOCIETY","50-20 45TH STREET (WOODSIDE)","Queen",11377,"TUE",NA,"4-5:30PM"
"FP","YESHUA WORLDWIDE MINISTRIES FOOD PANTRY","7911 CALDWELL AVENUE (MIDDLE VILLAGE)","Queen",11379,"THUR,SAT",NA,"10AM-1PM"
"FP","AGAPE CHRISTIAN CENTER","59-02 SUMMERFIELD ST. RIDGEWOOD","Queen",11385,"SAT",NA,"10-11:30AM"
"FP","COMMUNITY ALLIANCE INITIATIVE","60-85 MYRTLE AVENUE","Queen",11385,"FRI","1","10AM -12PM"
"FP","MOUNT MORIAH SEVENTH DAY ADVENTIST CHURCH FP","1834 DECATUR STREET (RIDGEWOOD)","Queen",11385,"SAT","1,3","8:30-9:30AM"
"FP","THE LEGACY CENTER COMMUNITY DEVELOPMENT CORP","71-02 CYPRESS HILL STREET (GLENDALE)","Queen",11385,"THUR",NA,"9AM-1PM"
"FP","WOODBINE","585 WOODWARD AVENUE (RIDGEWOOD)","Queen",11385,"MON,WED",NA,"9:30-10AM"
"FP","MORIAH CITY COMMUNITY FOOD PANTRY","206-14 LINDEN BLVD (CAMBRIA HEIGHTS)","Queen",11411,"WED",NA,"3-5PM"
"FP","RCA CAMBRIA HEIGHTS COMMUNITY CHURCH FP","116-12 220 STREET (CAMBRIA HEIGHTS)","Queen",11411,"SAT","4","9-11AM"
"FP","FIRST CHURCH OF GOD IN CHRIST, INC.","187-10 BAISLEY BLVD","Queen",11412,"WED",NA,"12-3PM"
"FP","FRESH ANOINTING INTERNATIONAL CHARITIES (FAIC)","182-10 LIBERTY AVENUE","Queen",11412,"THUR",NA,"12-3PM"
"FP","GOSPEL ASSEMBLY - QUEENS","109-14 FARMERS BLVD","Queen",11412,"WED,THUR,FRI,SAT",NA,"10AM -12PM"
"FP","IN THE BEGINNING OUTREACH, INC","189-13 LIBERTY AVENUE (ST. ALBANS)","Queen",11412,"WED",NA,"12:30-2PM"
"FP","MAJORITY COMMUNITY OUTREACH","115-21 FARMERS BLVD","Queen",11412,"THUR",NA,"9-11AM"
"FP","SECOND CHANCE AGAPE WORSHIP CENTER","200-12 HOLLIS AVENUE","Queen",11412,"THUR",NA,"12-2PM"
"FP","ST. ALBANS BAPTIST CHURCH","196-20 119TH AVENUE (ST. ALBANS)","Queen",11412,"SAT","1,3","10AM-12PM"
"FP","WE CARE PANTRY","201-14 HOLLIS AVENUE","Queen",11412,"SAT","2,4","10:30AM-12:30PM"
"FP","WORSHIP CHRISTIAN CENTER INC","113-16 FARMERS BLVD","Queen",11412,"FRI,SAT",NA,"10AM-1PM"
"FP","HOLY TEMPLE CHURCH, INC","136-25 SPRINGFIELD BLVD","Queen",11413,"SAT",NA,"11AM-12PM"
"FP","JAMAICA QUEENS WESLEYAN CHURCH PANTRY","134-49 228TH STREET (LAURELTON)","Queen",11413,"SAT",NA,"12-1:30PM"
"FP","LEBANON SEVENTH DAY ADVENTIST CHURCH","131-72 223RD STREET","Queen",11413,"THUR",NA,"5-7PM"
"FP","LINDEN SEVENTH DAY ADVENTIST CHURCH COMMUNITY SERVICES","228-20 137TH AVENUE","Queen",11413,"SUN",NA,"10AM-12PM"
"FP","ONE WAY CHURCH OF CHRIST","216-11 MERRICK BLVD.","Queen",11413,"SAT",NA,"10AM-1PM"
"FP","VFW #5298","143-17 SPRINGFIELD BLVD","Queen",11413,"WED",NA,"2-5PM"
