"type","pantry_name","address","borough","zipcode","days","weeks_in_month","hours"
"FP","OUR LADY OF GRACE MINISTRY","158-10 101ST ST.- HOWARD BEACH","Queen",11414,"TUE",NA,"10:30AM-12PM"
"FP","PROJECT L.E.A.D.","85-12 126TH STREET (KEW GARDENS)","Queen",11415,"SUN",NA,"7:30-9:30AM"
"FP","THE OZONE PARK PANTRY","83-10 ROCKAWAY BLVD (OZONE PARK)","Queen",11416,"SAT",NA,"10:30AM - 1PM"
"FP","MUNA SOCIAL SERVICE BAITUN NOOR MASJID","88-19 LIBERTY AVENUE (OZONE PARK)","Queen",11417,"THUR","1,3","4-5PM"
"FP","ZION TABERNACLE F.B.H. CHURCH","105-01 107 AVENUE (OZONE PARK)","Queen",11417,"TUE",NA,"1-3PM"
"FP","CALVARY'S MISSION","102-16 89TH AVENUE (RICHMOND HILL)","Queen",11418,"SAT",NA,"9-10AM"
"FP","ELOHIM CHRISTIAN CHURCH FOOD PANTRY","87-47 111TH STREET, RICHMOND HILLS","Queen",11418,"FRI",NA,"7-9AM"
"FP","HOLY CHILD JESUS FOOD PANTRY","112-06 86TH AVENUE (RICHMOND HILL)","Queen",11418,"MON, THUR",NA,"10AM-12PM"
"FP","RIVER FUND","89-11 LEFFERTS BLVD (RICHMOND HILL)","Queen",11418,"WED,SAT",NA,"9-11:30AM"
"FP","FAITH ASSEMBLY COMMUNITY OUTREACH","120-13 101ST AVENUE (SOUTH RICHMOND HILL)","Queen",11419,"SAT","4","10AM-12PM"
"FP","DELIVERANCE TEMPLE CHURCH OF JESUS CHRIST","134-10 ROCKAWAY BLVD SO. OZONE PARK","Queen",11420,"TUE",NA,"5:30-6:30PM"
"FP","LEVITICUS CHURCH","114-12 VAN WYCK EXPRESSWAY","Queen",11420,"WED,SAT",NA,"1-2PM/12-1PM"
"FP","ST. TERESA OF AVILA COMMUNITY SERVICES","129-04 109TH AVENUE","Queen",11420,"MON,THUR",NA,"9-10:30AM"
"FP","ST. PETERS - YVONNE GITTENS FOOD","137-28 244TH STREET","Queen",11422,"SAT",NA,"11-1PM"
"FP","TAURUS ASSOCIATES INC.","240-08 135TH AVENUE","Queen",11422,"WED",NA,"3-5PM"
"FP","BERACA SEVENTH DAY ADVENTIST CHURCH","91-19 191 STREET","Queen",11423,"WED",NA,"9:30AM-12PM"
"FP","HOLLIS COMMUNITY CHRISTIAN CENTER","191-22 JAMAICA AVENUE","Queen",11423,"SAT",NA,"10AM-12PM"
"FP","JESUS IS THE ANSWER - J.I.T.A. COMMUNITY OUTREACH","205-11 JAMAICA AVENUE","Queen",11423,"SAT",NA,"1-3PM"
"FP","MUNA SOCIAL SERVICE MASJID AR-RAYYAN","196-43 FOOTHILL AVENUE (HOLLIS)","Queen",11423,"WED","1,3","2-3PM"
"FP","MOUNT SINAI SEVENTH DAY ADVENTIST CHURCH","217-10 93RD AVENUE","Queen",11428,"WED",NA,"5-7PM"
"FP","DIVINE FOOD PANTRY","215-31 99TH AVENUE (QUEEN VILLAGE)","Queen",11429,"FRI","1,3","5-7:30PM"
"FP","HOLLIS AVENUE CONGREGATIONAL CHURCH","211-04 HOLLIS AVE., QUEENS VILLAGE","Queen",11429,"TUE",NA,"8-11AM"
"FP","HOPE RESTORATION MINISTRIES","101-01 SPRINGFIELD BLVD (QUEENS VILLAGE)","Queen",11429,"SAT","","2-4PM"
"FP","QUEENSBORO TEMPLE SEVENTH DAY ADVENTIST CHURCH","96-50 222ND STREET","Queen",11429,"WED",NA,"1-4PM"
"FP","VETS INC, HOLLIS GARDENS","202-14 HOLLIS AVENUE","Queen",11429,"THUR",NA,"3-5PM"
"FP","AIDS CENTER OF QUEENS COUNTY","161-21 JAMAICA AVE - 6TH FLOOR","Queen",11432,"THUR",NA,"8:30-9:30AM"
"FP","ALL MY CHILDREN","175-44 MAYFIELD ROAD","Queen",11432,"TUE",NA,"11AM-1PM"
"FP","FIRST PRESBYTERIAN CHURCH OF JAMAICA","89-60 164TH STREET","Queen",11432,"TUE,SAT","4","10AM-12PM/9-11AM"
"SK","FIRST PRESBYTERIAN CHURCH OF JAMAICA","89-60 164TH STREET","Queen",11432,"WED",NA,"5:30-6:30PM"
"FP","FIRST UNITED METHODIST CHURCH OF JAMAICA","162-10 HIGHLAND AVENUE","Queen",11432,"MON",NA,"8:30-9:30AM"
"FP","JAMAICA HISPANIC SEVENTH DAY ADVENTIST CHURCH","88-28 161 STREET","Queen",11432,"SUN",NA,"8-9AM"
"FP","JAMAICA SEVENTH DAY ADVENTIST CHURCH","88-28 163 STREET","Queen",11432,"SUN",NA,"9:30-11:30AM"
"FP","MASJID OMAR ABDEL AZIZ","8829 161ST STREET","Queen",11432,"WED","3","3-5PM"
"FP","ST. NICHOLAS OF TOLENTINE CHURCH- F.P.","150-75 GOETHALS AVENUE","Queen",11432,"THUR",NA,"9AM-12PM"
"FP","TABERNACLE OF PRAYER","90-07 MERRICK BLVD","Queen",11432,"WED",NA,"10-11:30AM"
"FP","THE SALVATION ARMY JAMAICA CITADEL CORPS","90-23 161ST STREET","Queen",11432,"TUE,THUR",NA,"10AM-1PM"
"SK","THE SALVATION ARMY JAMAICA CITADEL CORPS","90-23 161ST STREET","Queen",11432,"MON,TUES,WED",NA,"12PM-1PM"
"FP","ALLEN OUTREACH MINISTRY FEEDING PROGRAM","110-31 MERRICK BLVD","Queen",11433,"MON,THUR",NA,"3-5PM/11AM-1PM"
"FP","BETHANY BAPTIST CHURCH OF JAMAICA","157-11 111TH AVE","Queen",11433,"TUE,WED",NA,"11AM-2PM"
"FP","BETHEL GOSPEL TABERNACLE CHURCH","110-25 GUY R. BREWER BLVD.","Queen",11433,"WED",NA,"9:30-11AM"
"SK","BETHEL GOSPEL TABERNACLE CHURCH","110-25 GUY R. BREWER BLVD.","Queen",11433,"TUE,FRI",NA,"12-2PM"
"FP","COMMUNITY CHURCH OF CHRIST FOOD PANTRY","167-04 108TH AVENUE","Queen",11433,"WED",NA,"1-3PM"
"FP","MACEDONIA AME CHURCH","106-16 GUY R. BREWER BLVD","Queen",11433,"MON,TUE",NA,"7AM-3PM/7AM-1PM"
"SK","MACEDONIA AME CHURCH","106-16 GUY R. BREWER BLVD","Queen",11433,"TUE",NA,"10AM-12PM"
"FP","THE HARDING FORD VISION, INC","157-22 TUSKEGEE AIRMEN WAY, JAMAICA","Queen",11433,"WED,SAT",NA,"10AM-12PM/2-4PM"
"FP","CHRIST CHURCH INTERNATIONAL JOSEPH'S HOUSE","122-20 MERRILL STREET","Queen",11434,"SAT","2,4","10AM-12PM"
"FP","MARANATHA FRENCH SEVENTH DAY ADVENTIST CHURCH","173-04 LINDEN BLVD","Queen",11434,"SUN",NA,"10AM-12PM"
"FP","MINISTRY TOOLS INC","170-20 140TH AVE","Queen",11434,"THUR",NA,"4-6PM"
"FP","MORE THAN CONQUERORS GLOBAL MINISTRIES INC","153-56 ROCKAWAY BLVD","Queen",11434,"SAT",NA,"2-4PM"
"FP","NATIONAL SORORITY OF PHI DELTA KAPPA","117-08 MERRICK BLVD","Queen",11434,"THUR",NA,"11AM-1PM"
"FP","SINGH FAMILY CHARITY INC","121-13 SUTPHIN BLVD","Queen",11434,"SAT",NA,"8-10AM"
"FP","BLANCHE MEMORIAL CHURCH","109-74 SUTPHIN BLVD","Queen",11435,"TUE",NA,"9-10AM"
"FP","CHRIST APOSTOLIC CHURCH OF AMERICA, INC","108-02 SUTPHIN BLVD","Queen",11435,"SAT",NA,"9AM-1PM"
"FP","ICNA RELIEF USA","8791 144TH STREET","Queen",11435,"THUR",NA,"11AM-1PM"
"FP","MORRIS BROWN HELPING HAND FOOD PROGRAM","145-03 ROCKAWAY BLVD (SO. OZONE PARK)","Queen",11436,"WED",NA,"10AM-12PM"
"FP","SOUTH OZONE PARK SEVENTH DAY ADVENTIST CHURCH","120-12 140TH STREET","Queen",11436,"WED",NA,"12-2PM"
"FP","UNION UNITED FOOD PANTRY","126-22 150TH STREET","Queen",11436,"FRI","3","12-3PM"
"FP","MUNA SOCIAL SERVICE SOUTH JAMAICA","164-38 108TH AVENUE","Queen",11453,"WED","1,3","4-5PM"
"FP","AIDS CENTER OF QUEENS COUNTY (ACQC)","1600 CENTRAL AVENUE - 3RD FLOOR (FAR ROCKAWAY)","Queen",11691,"FRI",NA,"9:30-10:30AM"
"FP","FIRST PRESBYTERIAN RUSSELL SAGE MEMORIAL CHURCH OF FAR ROCKA","896 CENTRAL AVENUE (FAR ROCKAWAY)","Queen",11691,"SAT",NA,"9-10:30AM"
"FP","J.U.S.T.I.C.E. ORGANIZATION/JESUS IS JUSTICE MISSION INC.","223 BEACH 28TH STREET (FAR ROCKAWAY)","Queen",11691,"WED",NA,"12-2PM"
"FP","JEWISH COMMUNITY COUNCIL OF THE ROCKAWAY PENINSULA","1525 CENTRAL AVE","Queen",11691,"TUE,THUR",NA,"9:30AM - 1:30PM"
"FP","QUEENS DEFENDERS NOT FOR PROFIT","1922 MOTT AVENUE (FAR ROCKAWAY)","Queen",11691,"WED",NA,"12-1PM"
"FP","SOLID ROCK SEVENTH DAY ADVENTIST CHURCH","5205 ROCKAWAY BEACH BLVD","Queen",11691,"WED",NA,"10-11AM"
"FP","ST. MARY STAR OF THE SEA","19-20 NEW HAVEN AVENUE","Queen",11691,"TUE,FRI",NA,"1-3PM/1-3:30PM"
"FP","UNITED METHODIST CENTER IN FAR ROCKAWAY","1032 BEACH 19TH STREET (NEAR MOTT AVE)","Queen",11691,"TUE,THUR",NA,"9:30-11AM"
"SK","UNITED METHODIST CENTER IN FAR ROCKAWAY","1032 BEACH 19TH STREET (NEAR MOTT AVE)","Queen",11691,"MON,TUES,WED,THUR,FRI",NA,"12-1PM & 4:30-5:30PM"
"FP","BETHEL AME CHURCH/BETHEL ARVERNE COMM.","215 BEACH 77TH STREET","Queen",11692,"THUR",NA,"11AM-1PM"
